movie_name,is_adult,year_of_release,genres,actor_1,actor_2,actor_3,imdb_rating,comb
Dor,0,2006,drama,ayesha takia,shreyas talpade,gul panag,8.0,Dor drama ayesha takia shreyas talpade gul panag
Don,0,2006,action crime thriller,shah rukh khan,priyanka chopra,arjun rampal,7.2,Don action crime thriller shah rukh khan priyanka chopra arjun rampal
Family Ties of Blood,0,2006,action crime drama,amitabh bachchan,akshay kumar,bhoomika chawla,5.6,Family Ties of Blood action crime drama amitabh bachchan akshay kumar bhoomika chawla
Fanaa,0,2006,drama romance,aamir khan,kajol,rishi kapoor,7.2,Fanaa drama romance aamir khan kajol rishi kapoor
Gangster,0,2006,action crime drama,kangana ranaut,shiney ahuja,emraan hashmi,7.1,Gangster action crime drama kangana ranaut shiney ahuja emraan hashmi
Golmaal Fun Unlimited,0,2006,action comedy drama,ajay devgn,arshad warsi,sharman joshi,7.4,Golmaal Fun Unlimited action comedy drama ajay devgn arshad warsi sharman joshi
Devaki,0,2005,drama,ram kapoor,suman ranganath,arvin tucker,4.3,Devaki drama ram kapoor suman ranganath arvin tucker
Fight Club Members Only,0,2006,action crime,sunil shetty,sohail khan,zayed khan,3.2,Fight Club Members Only action crime sunil shetty sohail khan zayed khan
Dharti Kahe Pukar Ke,0,2006,action,ajay devgn,sharbani mukherjee,,6.3,Dharti Kahe Pukar Ke action ajay devgn sharbani mukherjee 
Humko Deewana Kar Gaye,0,2006,drama romance,akshay kumar,katrina kaif,bipasha basu,5.2,Humko Deewana Kar Gaye drama romance akshay kumar katrina kaif bipasha basu
Humko Tumse Pyaar Hai,0,2006,drama romance,arjun rampal,ameesha patel,bobby deol,4.8,Humko Tumse Pyaar Hai drama romance arjun rampal ameesha patel bobby deol
I See You,0,2006,comedy drama fantasy,arjun rampal,vipasha agarwal,chunky pandey,4.1,I See You comedy drama fantasy arjun rampal vipasha agarwal chunky pandey
Jaane Hoga Kya,0,2006,action crime sci-fi,aftab shivdasani,bipasha basu,preeti jhangiani,2.8,Jaane Hoga Kya action crime sci-fi aftab shivdasani bipasha basu preeti jhangiani
Jaan-E-Mann Let's Fall in Love... Again,0,2006,drama musical romance,salman khan,akshay kumar,preity zinta,6.0,Jaan-E-Mann Let's Fall in Love... Again drama musical romance salman khan akshay kumar preity zinta
Jawani Diwani A Youthful Joyride,0,2006,romance,emraan hashmi,celina jaitly,hrishitaa bhatt,2.8,Jawani Diwani A Youthful Joyride romance emraan hashmi celina jaitly hrishitaa bhatt
Holiday,0,2006,drama musical romance,onjolee nair,dino morea,kashmira shah,4.7,Holiday drama musical romance onjolee nair dino morea kashmira shah
Iqraar By Chance,0,2006,comedy romance,amarjeet,shilpa anand,deepa bakshi,4.7,Iqraar By Chance comedy romance amarjeet shilpa anand deepa bakshi
Khosla Ka Ghosla!,0,2006,comedy crime drama,anupam kher,boman irani,parvin dabas,8.3,Khosla Ka Ghosla! comedy crime drama anupam kher boman irani parvin dabas
Kabhi Alvida Naa Kehna,0,2006,drama romance,amitabh bachchan,shah rukh khan,abhishek bachchan,6.1,Kabhi Alvida Naa Kehna drama romance amitabh bachchan shah rukh khan abhishek bachchan
Love Ke Chakkar Mein,0,2006,comedy,rishi kapoor,akshat bhatia,namitha,4.2,Love Ke Chakkar Mein comedy rishi kapoor akshat bhatia namitha
Carry On Munna Bhai,0,2006,comedy drama romance,sanjay dutt,arshad warsi,vidya balan,8.1,Carry On Munna Bhai comedy drama romance sanjay dutt arshad warsi vidya balan
Kabul Express,0,2006,adventure comedy drama,john abraham,arshad warsi,salman shahid,6.8,Kabul Express adventure comedy drama john abraham arshad warsi salman shahid
Jigyaasa,0,2006,drama,nassar abdulla,rakesh bedi,hrishitaa bhatt,3.6,Jigyaasa drama nassar abdulla rakesh bedi hrishitaa bhatt
Krrish,0,2006,action sci-fi,rekha,hrithik roshan,priyanka chopra,6.3,Krrish action sci-fi rekha hrithik roshan priyanka chopra
Malamaal Weekly,0,2006,comedy drama romance,paresh rawal,om puri,riteish deshmukh,6.9,Malamaal Weekly comedy drama romance paresh rawal om puri riteish deshmukh
Omkara,0,2006,action crime drama,ajay devgn,saif ali khan,vivek oberoi,8.1,Omkara action crime drama ajay devgn saif ali khan vivek oberoi
Pyaar Ke Side Effects,0,2006,comedy drama romance,rahul bose,mallika sherawat,ranvir shorey,6.7,Pyaar Ke Side Effects comedy drama romance rahul bose mallika sherawat ranvir shorey
Naksha,0,2006,action adventure fantasy,sunny deol,vivek oberoi,sameera reddy,3.1,Naksha action adventure fantasy sunny deol vivek oberoi sameera reddy
Phir Hera Pheri,0,2006,comedy crime,akshay kumar,sunil shetty,paresh rawal,6.7,Phir Hera Pheri comedy crime akshay kumar sunil shetty paresh rawal
Pyare Mohan,0,2006,action comedy crime,fardeen khan,vivek oberoi,esha deol,3.2,Pyare Mohan action comedy crime fardeen khan vivek oberoi esha deol
Mere Jeevan Saathi,0,2006,drama music romance,akshay kumar,karisma kapoor,ameesha patel,3.5,Mere Jeevan Saathi drama music romance akshay kumar karisma kapoor ameesha patel
Prateeksha,0,1993,action crime,jeetendra,moushumi chatterjee,vinod mehra,5.7,Prateeksha action crime jeetendra moushumi chatterjee vinod mehra
Sacred Evil,0,2006,drama,sarika,lynsey pow,,6.0,Sacred Evil drama sarika lynsey pow 
Rang De Basanti,0,2006,comedy drama,aamir khan,siddharth,sharman joshi,8.2,Rang De Basanti comedy drama aamir khan siddharth sharman joshi
Shaadi Karke Phas Gaya Yaar,0,2006,comedy drama romance,salman khan,shilpa shetty kundra,reema lagoo,4.0,Shaadi Karke Phas Gaya Yaar comedy drama romance salman khan shilpa shetty kundra reema lagoo
Sandwich,0,2006,comedy thriller,govinda,raveena tandon,mahima chaudhry,5.4,Sandwich comedy thriller govinda raveena tandon mahima chaudhry
Shaadi Se Pehle,0,2006,comedy musical romance,akshaye khanna,ayesha takia,mallika sherawat,4.0,Shaadi Se Pehle comedy musical romance akshaye khanna ayesha takia mallika sherawat
Saawan... The Love Season,0,2006,drama fantasy romance,salman khan,saloni aswani,kapil jhaveri,2.2,Saawan... The Love Season drama fantasy romance salman khan saloni aswani kapil jhaveri
Shiva,0,2006,action crime drama,mohit ahlawat,priyanka kothari,vinod jaywant,4.0,Shiva action crime drama mohit ahlawat priyanka kothari vinod jaywant
Souten The Other Woman,0,2006,thriller,mahima chaudhry,padmini kolhapure,shakti kapoor,4.8,Souten The Other Woman thriller mahima chaudhry padmini kolhapure shakti kapoor
Shikhar,0,2005,drama,ajay devgn,shahid kapoor,bipasha basu,4.9,Shikhar drama ajay devgn shahid kapoor bipasha basu
Children of Heaven,0,1997,drama family sport,mohammad amir naji,amir farrokh hashemian,bahare seddiqi,8.3,Children of Heaven drama family sport mohammad amir naji amir farrokh hashemian bahare seddiqi
Tathastu,0,2006,crime drama thriller,sanjay dutt,ameesha patel,jaya prada,4.5,Tathastu crime drama thriller sanjay dutt ameesha patel jaya prada
The Killer,0,2006,action comedy crime,irrfan khan,emraan hashmi,priyanka kothari,4.6,The Killer action comedy crime irrfan khan emraan hashmi priyanka kothari
Umrao Jaan,0,2006,drama romance,aishwarya rai bachchan,shabana azmi,sunil shetty,5.5,Umrao Jaan drama romance aishwarya rai bachchan shabana azmi sunil shetty
Taxi No. 9 2 11 Nau Do Gyarah,0,2006,comedy drama thriller,nana patekar,john abraham,sonali kulkarni,7.2,Taxi No. 9 2 11 Nau Do Gyarah comedy drama thriller nana patekar john abraham sonali kulkarni
Teesri Aankh The Hidden Camera,0,2006,action crime thriller,sunny deol,ameesha patel,neha dhupia,2.5,Teesri Aankh The Hidden Camera action crime thriller sunny deol ameesha patel neha dhupia
Vivah,0,2006,drama family musical,shahid kapoor,amrita rao,anupam kher,6.6,Vivah drama family musical shahid kapoor amrita rao anupam kher
Utthaan,0,2006,drama romance thriller,priyanshu chatterjee,neha dhupia,,4.4,Utthaan drama romance thriller priyanshu chatterjee neha dhupia 
Waris Shah Ishq Daa Waaris,0,2006,drama history,gurdas maan,juhi chawla,sushant singh,7.0,Waris Shah Ishq Daa Waaris drama history gurdas maan juhi chawla sushant singh
Woh Lamhe,0,2006,biography drama romance,kangana ranaut,shiney ahuja,shaad randhawa,6.6,Woh Lamhe biography drama romance kangana ranaut shiney ahuja shaad randhawa
What If?,0,2006,drama,paresh rawal,konkona sen sharma,jimmy sheirgill,6.7,What If? drama paresh rawal konkona sen sharma jimmy sheirgill
Umar,0,2006,crime drama musical,jimmy sheirgill,shenaz treasury,kader khan,5.7,Umar crime drama musical jimmy sheirgill shenaz treasury kader khan
Zindaggi Rocks,0,2006,drama romance,sushmita sen,shiney ahuja,julian burkhardt,4.0,Zindaggi Rocks drama romance sushmita sen shiney ahuja julian burkhardt
Tom Dick and Harry,0,2006,comedy romance,rakesh bedi,bobby darling,avtar gill,3.2,Tom Dick and Harry comedy romance rakesh bedi bobby darling avtar gill
Aashiq Banaya Aapne Love Takes Over,0,2005,drama romance thriller,emraan hashmi,tanushree dutta,sonu sood,4.2,Aashiq Banaya Aapne Love Takes Over drama romance thriller emraan hashmi tanushree dutta sonu sood
Anjaane The Unkown,0,2005,horror,manisha koirala,sanjay kapoor,helen,4.0,Anjaane The Unkown horror manisha koirala sanjay kapoor helen
Apaharan,0,2005,action crime drama,ajay devgn,nana patekar,bipasha basu,7.4,Apaharan action crime drama ajay devgn nana patekar bipasha basu
Bachke Rehna Re Baba,0,2005,comedy,rekha,mallika sherawat,paresh rawal,2.7,Bachke Rehna Re Baba comedy rekha mallika sherawat paresh rawal
7 1/2 Phere More Than a Wedding,0,2005,comedy drama,juhi chawla,irrfan khan,manoj pahwa,5.4,7 1/2 Phere More Than a Wedding comedy drama juhi chawla irrfan khan manoj pahwa
A Sublime Love Story Barsaat,0,2005,drama romance,bobby deol,bipasha basu,priyanka chopra,4.0,A Sublime Love Story Barsaat drama romance bobby deol bipasha basu priyanka chopra
Bewafaa,0,2005,drama romance,anil kapoor,akshay kumar,kareena kapoor,4.3,Bewafaa drama romance anil kapoor akshay kumar kareena kapoor
Black,0,2005,drama,amitabh bachchan,rani mukerji,shernaz patel,8.2,Black drama amitabh bachchan rani mukerji shernaz patel
Zinda,0,2006,action drama mystery,sanjay dutt,john abraham,lara dutta,5.0,Zinda action drama mystery sanjay dutt john abraham lara dutta
Bluffmaster!,0,2005,comedy crime drama,abhishek bachchan,priyanka chopra,riteish deshmukh,6.6,Bluffmaster! comedy crime drama abhishek bachchan priyanka chopra riteish deshmukh
99.9 FM,0,2005,crime drama,shawar ali,jaipreet nagra,raima sen,4.8,99.9 FM crime drama shawar ali jaipreet nagra raima sen
Bhola in Bollywood,0,2004,comedy,ali asgar,raj babbar,suresh chatwal,6.6,Bhola in Bollywood comedy ali asgar raj babbar suresh chatwal
Bhagmati,0,2005,animation drama history,tabu,milind soman,j.v. somayajulu,6.5,Bhagmati animation drama history tabu milind soman j.v. somayajulu
Blackmail,0,2005,action drama thriller,ajay devgn,sunil shetty,priyanka chopra,4.1,Blackmail action drama thriller ajay devgn sunil shetty priyanka chopra
Bunty Aur Babli,0,2005,comedy drama romance,abhishek bachchan,rani mukerji,amitabh bachchan,6.2,Bunty Aur Babli comedy drama romance abhishek bachchan rani mukerji amitabh bachchan
Chaahat Ek Nasha...,0,2005,drama romance thriller,aryan vaid,manisha koirala,preeti jhangiani,4.0,Chaahat Ek Nasha... drama romance thriller aryan vaid manisha koirala preeti jhangiani
Chetna The Excitement,0,2005,thriller,jatin grewal,kiran kumar,navnit ravi rana,3.2,Chetna The Excitement thriller jatin grewal kiran kumar navnit ravi rana
Chand Sa Roshan Chehra,0,2005,romance,samir aftab,talat aziz,tamannaah bhatia,4.9,Chand Sa Roshan Chehra romance samir aftab talat aziz tamannaah bhatia
Chocolate Deep Dark Secrets,0,2005,crime drama mystery,anil kapoor,sunil shetty,arshad warsi,4.8,Chocolate Deep Dark Secrets crime drama mystery anil kapoor sunil shetty arshad warsi
'D',0,2005,crime drama thriller,randeep hooda,chunky pandey,rukhsar rehman,6.8,'D' crime drama thriller randeep hooda chunky pandey rukhsar rehman
Deewane Huye Paagal,0,2005,action comedy drama,akshay kumar,sunil shetty,shahid kapoor,5.3,Deewane Huye Paagal action comedy drama akshay kumar sunil shetty shahid kapoor
Bullet Ek Dhamaka,0,2005,action drama,saayli buva,natalya gudkova,iqbal khan,3.7,Bullet Ek Dhamaka action drama saayli buva natalya gudkova iqbal khan
Chehraa,0,2005,thriller,bipasha basu,dino morea,preeti jhangiani,3.8,Chehraa thriller bipasha basu dino morea preeti jhangiani
Dil Jo Bhi Kahey...,0,2005,drama romance,amitabh bachchan,revathy,karan sharma,4.8,Dil Jo Bhi Kahey... drama romance amitabh bachchan revathy karan sharma
Dosti Friends Forever,0,2005,drama romance,akshay kumar,bobby deol,kareena kapoor,5.5,Dosti Friends Forever drama romance akshay kumar bobby deol kareena kapoor
Classic Dance of Love,0,2005,drama,mithun chakraborty,meghna naidu,vikas bhardwaj,4.9,Classic Dance of Love drama mithun chakraborty meghna naidu vikas bhardwaj
Dus,0,2005,action crime drama,sanjay dutt,sunil shetty,abhishek bachchan,5.5,Dus action crime drama sanjay dutt sunil shetty abhishek bachchan
Elaan,0,2005,action thriller,arjun rampal,ameesha patel,john abraham,4.4,Elaan action thriller arjun rampal ameesha patel john abraham
Fareb,0,2005,drama thriller,shilpa shetty kundra,manoj bajpayee,shamita shetty,4.3,Fareb drama thriller shilpa shetty kundra manoj bajpayee shamita shetty
Ek Ajnabee,0,2005,action crime drama,amitabh bachchan,arjun rampal,perizaad zorabian,5.2,Ek Ajnabee action crime drama amitabh bachchan arjun rampal perizaad zorabian
Fun Can Be Dangerous Sometimes,0,2005,thriller,siddharth koirala,aryan vaid,payal rohatgi,3.3,Fun Can Be Dangerous Sometimes thriller siddharth koirala aryan vaid payal rohatgi
Ek Khiladi Ek Haseena,0,2005,comedy crime thriller,fardeen khan,koena mitra,kay kay menon,5.8,Ek Khiladi Ek Haseena comedy crime thriller fardeen khan koena mitra kay kay menon
Double Cross Ek Dhoka,0,2005,comedy,ayesha jhulka,negar khan,,4.1,Double Cross Ek Dhoka comedy ayesha jhulka negar khan 
Dreams,0,2006,drama,aseel adel,bashir al majid,mohamed hashim,6.8,Dreams drama aseel adel bashir al majid mohamed hashim
Home Delivery Aapko... Ghar Tak,0,2005,comedy romance,vivek oberoi,mahima chaudhry,ayesha takia,3.2,Home Delivery Aapko... Ghar Tak comedy romance vivek oberoi mahima chaudhry ayesha takia
Garam Masala,0,2005,comedy romance,akshay kumar,john abraham,paresh rawal,6.7,Garam Masala comedy romance akshay kumar john abraham paresh rawal
Iqbal,0,2005,drama sport,shreyas talpade,naseeruddin shah,shweta basu prasad,8.1,Iqbal drama sport shreyas talpade naseeruddin shah shweta basu prasad
Jai Chiranjeeva,0,2005,action comedy drama,chiranjeevi,bhoomika chawla,sameera reddy,5.8,Jai Chiranjeeva action comedy drama chiranjeevi bhoomika chawla sameera reddy
Hazaaron Khwaishein Aisi,0,2003,drama,kay kay menon,shiney ahuja,chitrangda singh,7.9,Hazaaron Khwaishein Aisi drama kay kay menon shiney ahuja chitrangda singh
Insan,0,2005,action crime drama,akshay kumar,ajay devgn,tusshar kapoor,4.6,Insan action crime drama akshay kumar ajay devgn tusshar kapoor
Jo Bole So Nihaal,0,2005,action comedy,sunny deol,thomas tevana,gary castro churchwell,3.5,Jo Bole So Nihaal action comedy sunny deol thomas tevana gary castro churchwell
Karam,0,2005,action thriller,john abraham,priyanka chopra,bharat dabholkar,5.5,Karam action thriller john abraham priyanka chopra bharat dabholkar
Kaal,0,2005,adventure horror mystery,ajay devgn,vivek oberoi,john abraham,4.6,Kaal adventure horror mystery ajay devgn vivek oberoi john abraham
Kalyug,0,2005,action crime drama,kunal khemu,deepal shaw,smiley suri,6.5,Kalyug action crime drama kunal khemu deepal shaw smiley suri
Kasak,0,2005,drama,lucky ali,meera,puneet issar,4.6,Kasak drama lucky ali meera puneet issar
Hanuman,0,2005,animation,mukesh khanna,viraj,mona shetty,7.3,Hanuman animation mukesh khanna viraj mona shetty
James,0,2005,action romance,mohit ahlawat,priyanka kothari,,3.6,James action romance mohit ahlawat priyanka kothari 
Kisna The Warrior Poet,0,2005,drama history musical,vivek oberoi,isha sharvani,antonia bernath,4.5,Kisna The Warrior Poet drama history musical vivek oberoi isha sharvani antonia bernath
Koi Aap Sa But Lovers Have to Be Friends,0,2005,comedy drama romance,aftab shivdasani,anita hassanandani reddy,dipannita sharma,5.4,Koi Aap Sa But Lovers Have to Be Friends comedy drama romance aftab shivdasani anita hassanandani reddy dipannita sharma
Khamoshh... Khauff Ki Raat,0,2005,mystery thriller,shilpa shetty kundra,juhi chawla,shawar ali,3.3,Khamoshh... Khauff Ki Raat mystery thriller shilpa shetty kundra juhi chawla shawar ali
Jurm,0,2005,crime drama mystery,kamal adib,bobby deol,lara dutta,5.5,Jurm crime drama mystery kamal adib bobby deol lara dutta
Kuchh Meetha Ho Jaye,0,2005,comedy romance,arshad warsi,mahima chaudhry,parvin dabas,3.4,Kuchh Meetha Ho Jaye comedy romance arshad warsi mahima chaudhry parvin dabas
Kyaa Kool Hai Hum,0,2005,comedy mystery,tusshar kapoor,riteish deshmukh,isha koppikar,6.1,Kyaa Kool Hai Hum comedy mystery tusshar kapoor riteish deshmukh isha koppikar
Lucky No Time for Love,0,2005,drama musical romance,salman khan,sneha ullal,mithun chakraborty,4.7,Lucky No Time for Love drama musical romance salman khan sneha ullal mithun chakraborty
Main Aisa Hi Hoon,0,2005,drama family musical,ajay devgn,sushmita sen,esha deol,4.7,Main Aisa Hi Hoon drama family musical ajay devgn sushmita sen esha deol
Kyon Ki...,0,2005,drama romance,salman khan,kareena kapoor,rimi sen,5.5,Kyon Ki... drama romance salman khan kareena kapoor rimi sen
Main Meri Patni... Aur Woh!,0,2005,comedy drama romance,rajpal yadav,rituparna sengupta,naseeruddin shah,7.3,Main Meri Patni... Aur Woh! comedy drama romance rajpal yadav rituparna sengupta naseeruddin shah
I Did Not Kill Gandhi,0,2005,drama,anupam kher,urmila matondkar,parvin dabas,7.4,I Did Not Kill Gandhi drama anupam kher urmila matondkar parvin dabas
Maine Pyaar Kyun Kiya,0,2005,comedy drama romance,salman khan,sushmita sen,katrina kaif,5.5,Maine Pyaar Kyun Kiya comedy drama romance salman khan sushmita sen katrina kaif
Mangal Pandey The Rising,0,2005,biography drama history,aamir khan,rani mukerji,toby stephens,6.6,Mangal Pandey The Rising biography drama history aamir khan rani mukerji toby stephens
Koi Mere Dil Mein Hai,0,2005,drama romance,dia mirza,,unknown,4.8,Koi Mere Dil Mein Hai drama romance dia mirza  unknown
Mr Prime Minister,0,2005,comedy,dev anand,prem chopra,milind gunaji,5.1,Mr Prime Minister comedy dev anand prem chopra milind gunaji
My Brother... Nikhil,0,2005,drama sport,sanjay suri,juhi chawla,purab kohli,7.3,My Brother... Nikhil drama sport sanjay suri juhi chawla purab kohli
My Wife's Murder,0,2005,drama mystery thriller,anil kapoor,suchitra krishnamoorthi,nandana sen,6.2,My Wife's Murder drama mystery thriller anil kapoor suchitra krishnamoorthi nandana sen
Naina,0,2005,drama horror mystery,urmila matondkar,anuj sawhney,malavikka,4.3,Naina drama horror mystery urmila matondkar anuj sawhney malavikka
Neal 'N' Nikki,0,2005,comedy musical romance,uday chopra,tanishaa mukerji,abhishek bachchan,3.2,Neal 'N' Nikki comedy musical romance uday chopra tanishaa mukerji abhishek bachchan
No Entry,0,2005,comedy drama musical,anil kapoor,fardeen khan,salman khan,6.6,No Entry comedy drama musical anil kapoor fardeen khan salman khan
Padmashree Laloo Prasad Yadav,0,2005,comedy,sunil shetty,masumeh makhija,mahesh manjrekar,2.5,Padmashree Laloo Prasad Yadav comedy sunil shetty masumeh makhija mahesh manjrekar
Page 3,0,2005,drama,konkona sen sharma,atul kulkarni,sandhya mridul,7.3,Page 3 drama konkona sen sharma atul kulkarni sandhya mridul
Morning Raga,0,2004,drama music,shabana azmi,prakash kovelamudi,lillete dubey,6.9,Morning Raga drama music shabana azmi prakash kovelamudi lillete dubey
Parineeta,0,2005,drama musical romance,saif ali khan,vidya balan,sanjay dutt,7.2,Parineeta drama musical romance saif ali khan vidya balan sanjay dutt
Pehchaan The Face of Truth,0,2005,drama,vinod khanna,rati agnihotri,raveena tandon,5.8,Pehchaan The Face of Truth drama vinod khanna rati agnihotri raveena tandon
Paheli,0,2005,drama fantasy romance,shah rukh khan,rani mukerji,anupam kher,6.5,Paheli drama fantasy romance shah rukh khan rani mukerji anupam kher
Rog,0,2005,mystery romance thriller,irrfan khan,ilene hamann,himanshu malik,5.1,Rog mystery romance thriller irrfan khan ilene hamann himanshu malik
Pyaar Mein Twist,0,2005,comedy drama musical,rishi kapoor,dimple kapadia,,5.9,Pyaar Mein Twist comedy drama musical rishi kapoor dimple kapadia 
Salaam Namaste,0,2005,comedy drama romance,saif ali khan,preity zinta,arshad warsi,6.2,Salaam Namaste comedy drama romance saif ali khan preity zinta arshad warsi
Revati,0,2005,drama,kashmira shah,shreyas talpade,ayub khan,5.2,Revati drama kashmira shah shreyas talpade ayub khan
Sarkar,0,2005,action crime drama,amitabh bachchan,abhishek bachchan,kay kay menon,7.6,Sarkar action crime drama amitabh bachchan abhishek bachchan kay kay menon
Sehar,0,2005,action crime drama,arshad warsi,pankaj kapur,mahima chaudhry,7.8,Sehar action crime drama arshad warsi pankaj kapur mahima chaudhry
Shabd,0,2005,drama,sanjay dutt,aishwarya rai bachchan,zayed khan,5.1,Shabd drama sanjay dutt aishwarya rai bachchan zayed khan
Shabnam Mausi,0,2005,drama,ashutosh rana,,unknown,6.2,Shabnam Mausi drama ashutosh rana  unknown
Sheesha,0,2005,drama romance thriller,neha dhupia,sonu sood,vivek shauq,3.5,Sheesha drama romance thriller neha dhupia sonu sood vivek shauq
Ramji Londonwaley,0,2005,comedy drama family,madhavan,samita bangargi,satish shah,6.7,Ramji Londonwaley comedy drama family madhavan samita bangargi satish shah
Silsiilay,0,2005,drama,tabu,bhoomika chawla,riya sen,4.1,Silsiilay drama tabu bhoomika chawla riya sen
Socha Na Tha,0,2005,comedy romance,abhay deol,ayesha takia,ayesha jhulka,7.5,Socha Na Tha comedy romance abhay deol ayesha takia ayesha jhulka
Taj Mahal An Eternal Love Story,0,2005,drama history musical,zulfi sayed,sonya jehan,kabir bedi,5.2,Taj Mahal An Eternal Love Story drama history musical zulfi sayed sonya jehan kabir bedi
Tango Charlie,0,2005,action adventure drama,ajay devgn,bobby deol,sanjay dutt,6.0,Tango Charlie action adventure drama ajay devgn bobby deol sanjay dutt
The Film,0,2005,crime drama mystery,nassar abdulla,ravi baswani,rakesh bedi,6.5,The Film crime drama mystery nassar abdulla ravi baswani rakesh bedi
Vaada,0,2005,crime drama mystery,arjun rampal,zayed khan,ameesha patel,5.6,Vaada crime drama mystery arjun rampal zayed khan ameesha patel
Vaah! Life Ho Toh Aisi!,0,2005,comedy drama family,shahid kapoor,amrita rao,sanjay dutt,4.4,Vaah! Life Ho Toh Aisi! comedy drama family shahid kapoor amrita rao sanjay dutt
Ssukh,0,2005,comedy family romance,aarti chhabria,jackie shroff,,5.3,Ssukh comedy family romance aarti chhabria jackie shroff 
Shaadi No. 1,0,2005,comedy,fardeen khan,zayed khan,sharman joshi,3.5,Shaadi No. 1 comedy fardeen khan zayed khan sharman joshi
Viruddh... Family Comes First,0,2005,drama family,amitabh bachchan,sharmila tagore,john abraham,7.1,Viruddh... Family Comes First drama family amitabh bachchan sharmila tagore john abraham
Waqt The Race Against Time,0,2005,comedy drama family,amitabh bachchan,akshay kumar,priyanka chopra,6.8,Waqt The Race Against Time comedy drama family amitabh bachchan akshay kumar priyanka chopra
Vidhyaarthi The Power of Students,0,2006,action,vikram aditya,akash ajmera,ishrat ali,5.0,Vidhyaarthi The Power of Students action vikram aditya akash ajmera ishrat ali
Yakeen,0,2005,drama thriller,arjun rampal,priyanka chopra,kim sharma,5.1,Yakeen drama thriller arjun rampal priyanka chopra kim sharma
Zeher,0,2005,crime drama mystery,emraan hashmi,shamita shetty,udita goswami,5.4,Zeher crime drama mystery emraan hashmi shamita shetty udita goswami
Veer-Zaara,0,2004,drama family musical,shah rukh khan,preity zinta,rani mukerji,7.8,Veer-Zaara drama family musical shah rukh khan preity zinta rani mukerji
I'm Always Here,0,2004,action comedy drama,shah rukh khan,sushmita sen,sunil shetty,7.0,I'm Always Here action comedy drama shah rukh khan sushmita sen sunil shetty
Zameer,0,2005,drama romance,ajay devgn,ameesha patel,mahima chaudhry,2.9,Zameer drama romance ajay devgn ameesha patel mahima chaudhry
Mujhse Shaadi Karogi,0,2004,comedy drama musical,salman khan,akshay kumar,priyanka chopra,6.7,Mujhse Shaadi Karogi comedy drama musical salman khan akshay kumar priyanka chopra
Dhoom,0,2004,action crime thriller,abhishek bachchan,john abraham,uday chopra,6.7,Dhoom action crime thriller abhishek bachchan john abraham uday chopra
Khakee,0,2004,action crime drama,amitabh bachchan,akshay kumar,ajay devgn,7.4,Khakee action crime drama amitabh bachchan akshay kumar ajay devgn
Hum Tum,0,2004,comedy drama romance,saif ali khan,rani mukerji,kiron kher,7.0,Hum Tum comedy drama romance saif ali khan rani mukerji kiron kher
Hulchul,0,2004,action comedy drama,akshaye khanna,kareena kapoor,sunil shetty,6.9,Hulchul action comedy drama akshaye khanna kareena kapoor sunil shetty
Murder,0,2004,drama thriller,mallika sherawat,ashmit patel,emraan hashmi,5.4,Murder drama thriller mallika sherawat ashmit patel emraan hashmi
Yuva,0,2004,action drama thriller,ajay devgn,abhishek bachchan,rani mukerji,7.4,Yuva action drama thriller ajay devgn abhishek bachchan rani mukerji
Aitraaz,0,2004,drama romance thriller,akshay kumar,kareena kapoor,priyanka chopra,6.6,Aitraaz drama romance thriller akshay kumar kareena kapoor priyanka chopra
Aetbaar,0,2004,action drama musical,amitabh bachchan,john abraham,bipasha basu,4.6,Aetbaar action drama musical amitabh bachchan john abraham bipasha basu
Ab Tumhare Hawale Watan Saathiyo,0,2004,action drama war,amitabh bachchan,akshay kumar,bobby deol,4.6,Ab Tumhare Hawale Watan Saathiyo action drama war amitabh bachchan akshay kumar bobby deol
Aan Men at Work,0,2004,action crime drama,shatrughan sinha,akshay kumar,sunil shetty,5.7,Aan Men at Work action crime drama shatrughan sinha akshay kumar sunil shetty
