movie_name,is_adult,year_of_release,genres,actor_1,actor_2,actor_3,imdb_rating,comb
Bichhoo,0,2000,action crime drama,bobby deol,rani mukerji,ashish vidyarthi,4.6,Bichhoo action crime drama bobby deol rani mukerji ashish vidyarthi
Baaghi,0,2000,action crime drama,sanjay dutt,manisha koirala,aditya pancholi,4.4,Baaghi action crime drama sanjay dutt manisha koirala aditya pancholi
Bulandi,0,2000,action drama,anil kapoor,rekha,raveena tandon,5.4,Bulandi action drama anil kapoor rekha raveena tandon
Billa No. 786,0,2000,action,mithun chakraborty,gajendra chouhan,siddharth dhawan,4.5,Billa No. 786 action mithun chakraborty gajendra chouhan siddharth dhawan
Bhai Thakur,0,2000,action drama,dharmendra,siddique durrani,dinesh hingoo,4.0,Bhai Thakur action drama dharmendra siddique durrani dinesh hingoo
Bawandar,0,2000,drama,nandita das,raghuvir yadav,deepti naval,7.1,Bawandar drama nandita das raghuvir yadav deepti naval
Astitva,0,2000,drama,tabu,sachin khedekar,mohnish bahl,7.3,Astitva drama tabu sachin khedekar mohnish bahl
Champion,0,2000,action comedy drama,sunny deol,manisha koirala,rahul dev,4.2,Champion action comedy drama sunny deol manisha koirala rahul dev
Deewane,0,2000,action romance,ajay devgn,urmila matondkar,mahima chaudhry,4.6,Deewane action romance ajay devgn urmila matondkar mahima chaudhry
Dhaai Akshar Prem Ke,0,2000,drama romance,abhishek bachchan,aishwarya rai bachchan,amrish puri,3.8,Dhaai Akshar Prem Ke drama romance abhishek bachchan aishwarya rai bachchan amrish puri
Gang,0,2000,action crime drama,jackie shroff,nana patekar,kumar gaurav,6.3,Gang action crime drama jackie shroff nana patekar kumar gaurav
Ghaath,0,2000,crime drama thriller,manoj bajpayee,tabu,om puri,4.9,Ghaath crime drama thriller manoj bajpayee tabu om puri
Hadh Kar Di Aapne,0,2000,comedy romance,govinda,rani mukerji,johnny lever,5.3,Hadh Kar Di Aapne comedy romance govinda rani mukerji johnny lever
Har Dil Jo Pyar Karega...,0,2000,comedy drama musical,salman khan,preity zinta,rani mukerji,5.2,Har Dil Jo Pyar Karega... comedy drama musical salman khan preity zinta rani mukerji
Hari-Bhari,0,2000,drama family,shabana azmi,rajit kapoor,rajeshwari sachdev,5.4,Hari-Bhari drama family shabana azmi rajit kapoor rajeshwari sachdev
Hera Pheri,0,2000,action comedy crime,akshay kumar,sunil shetty,paresh rawal,8.2,Hera Pheri action comedy crime akshay kumar sunil shetty paresh rawal
Hamara Dil Aapke Paas Hai,0,2000,drama romance,anil kapoor,aishwarya rai bachchan,sonali bendre,5.6,Hamara Dil Aapke Paas Hai drama romance anil kapoor aishwarya rai bachchan sonali bendre
Hum To Mohabbat Karega,0,2000,action comedy romance,karisma kapoor,bobby deol,rohit roy,2.7,Hum To Mohabbat Karega action comedy romance karisma kapoor bobby deol rohit roy
Hey Ram,0,2000,crime drama history,kamal haasan,shah rukh khan,rani mukerji,7.9,Hey Ram crime drama history kamal haasan shah rukh khan rani mukerji
Dil Pe Mat Le Yaar!!,0,2000,drama,manoj bajpayee,tabu,saurabh shukla,5.0,Dil Pe Mat Le Yaar!! drama manoj bajpayee tabu saurabh shukla
Chal Mere Bhai,0,2000,comedy romance,sanjay dutt,salman khan,karisma kapoor,4.7,Chal Mere Bhai comedy romance sanjay dutt salman khan karisma kapoor
Gaja Gamini,0,2000,drama fantasy,madhuri dixit,shabana azmi,naseeruddin shah,5.1,Gaja Gamini drama fantasy madhuri dixit shabana azmi naseeruddin shah
Jallad No. 1,0,2000,action,ishrat ali,dharmendra,shakti kapoor,5.0,Jallad No. 1 action ishrat ali dharmendra shakti kapoor
Jis Desh Mein Ganga Rehta Hain,0,2000,comedy crime drama,govinda,sonali bendre,rinke khanna,4.9,Jis Desh Mein Ganga Rehta Hain comedy crime drama govinda sonali bendre rinke khanna
Jung,0,2000,action crime drama,sanjay dutt,jackie shroff,aditya pancholi,4.2,Jung action crime drama sanjay dutt jackie shroff aditya pancholi
Jungle,0,2000,action adventure romance,sunil shetty,fardeen khan,urmila matondkar,6.1,Jungle action adventure romance sunil shetty fardeen khan urmila matondkar
Kahin Pyaar Na Ho Jaaye,0,2000,comedy romance,jackie shroff,salman khan,rani mukerji,4.4,Kahin Pyaar Na Ho Jaaye comedy romance jackie shroff salman khan rani mukerji
Joru Ka Ghulam,0,2000,comedy drama romance,govinda,twinkle khanna,kader khan,5.1,Joru Ka Ghulam comedy drama romance govinda twinkle khanna kader khan
Khauff,0,2000,action drama thriller,sanjay dutt,manisha koirala,sharad s. kapoor,4.5,Khauff action drama thriller sanjay dutt manisha koirala sharad s. kapoor
Khiladi 420,0,2000,action romance thriller,akshay kumar,mahima chaudhry,antara mali,5.3,Khiladi 420 action romance thriller akshay kumar mahima chaudhry antara mali
Krodh,0,2000,action drama,sunil shetty,johnny lever,rambha,4.3,Krodh action drama sunil shetty johnny lever rambha
Kurukshetra,0,2000,action crime drama,sanjay dutt,mahima chaudhry,om puri,6.1,Kurukshetra action crime drama sanjay dutt mahima chaudhry om puri
Call,0,2000,action drama romance,anil kapoor,madhuri dixit,namrata shirodkar,6.8,Call action drama romance anil kapoor madhuri dixit namrata shirodkar
Mela,0,2000,action adventure comedy,aamir khan,twinkle khanna,faisal khan,3.8,Mela action adventure comedy aamir khan twinkle khanna faisal khan
Phir Bhi Dil Hai Hindustani,0,2000,comedy drama musical,shah rukh khan,juhi chawla,johnny lever,6.2,Phir Bhi Dil Hai Hindustani comedy drama musical shah rukh khan juhi chawla johnny lever
Raja Ko Rani Se Pyar Ho Gaya,0,2000,comedy musical romance,arvind swamy,manisha koirala,dilip dhawan,3.5,Raja Ko Rani Se Pyar Ho Gaya comedy musical romance arvind swamy manisha koirala dilip dhawan
Raju Chacha,0,2000,action comedy drama,rishi kapoor,ajay devgn,kajol,5.1,Raju Chacha action comedy drama rishi kapoor ajay devgn kajol
Nidaan,0,2000,drama romance,shivaji satam,reema lagoo,nisha bains,6.6,Nidaan drama romance shivaji satam reema lagoo nisha bains
Shikari,0,2000,drama thriller,govinda,tabu,karisma kapoor,4.6,Shikari drama thriller govinda tabu karisma kapoor
Ramayana The Legend of Prince Rama,0,1992,action adventure animation,bryan cranston,arun govil,srija,8.7,Ramayana The Legend of Prince Rama action adventure animation bryan cranston arun govil srija
Tera Jadoo Chal Gayaa,0,2000,musical romance,abhishek bachchan,kirti reddy,sanjay suri,3.0,Tera Jadoo Chal Gayaa musical romance abhishek bachchan kirti reddy sanjay suri
Meri Jung Ka Elaan,0,2000,action,dharmendra,sapna,satnam kaur,5.1,Meri Jung Ka Elaan action dharmendra sapna satnam kaur
Kunwara,0,2000,comedy drama romance,govinda,urmila matondkar,nagma,5.1,Kunwara comedy drama romance govinda urmila matondkar nagma
The Revenge Geeta Mera Naam,0,2000,action,dharmendra,kalyani thakkar,durgesh nandini,2.4,The Revenge Geeta Mera Naam action dharmendra kalyani thakkar durgesh nandini
Aa Ab Laut Chalen,0,1999,drama musical romance,rajesh khanna,akshaye khanna,aishwarya rai bachchan,5.4,Aa Ab Laut Chalen drama musical romance rajesh khanna akshaye khanna aishwarya rai bachchan
Arjun Pandit,0,1999,action crime romance,sunny deol,juhi chawla,saurabh shukla,5.2,Arjun Pandit action crime romance sunny deol juhi chawla saurabh shukla
Baadshah,0,1999,action comedy crime,shah rukh khan,twinkle khanna,amrish puri,6.8,Baadshah action comedy crime shah rukh khan twinkle khanna amrish puri
Aarzoo,0,1999,action drama musical,madhuri dixit,akshay kumar,saif ali khan,5.4,Aarzoo action drama musical madhuri dixit akshay kumar saif ali khan
Anari No. 1,0,1999,comedy,govinda,raveena tandon,simran,5.0,Anari No. 1 comedy govinda raveena tandon simran
Bade Dilwala,0,1999,comedy drama romance,sunil shetty,priya gill,paresh rawal,3.6,Bade Dilwala comedy drama romance sunil shetty priya gill paresh rawal
Sultaan,0,2000,action drama,vikas anand,birbal,mithun chakraborty,5.9,Sultaan action drama vikas anand birbal mithun chakraborty
Tarkieb,0,2000,mystery thriller,nana patekar,tabu,shilpa shetty kundra,5.1,Tarkieb mystery thriller nana patekar tabu shilpa shetty kundra
Biwi No. 1,0,1999,comedy drama romance,karisma kapoor,salman khan,anil kapoor,5.7,Biwi No. 1 comedy drama romance karisma kapoor salman khan anil kapoor
Bhopal Express,0,1999,drama,kay kay menon,nethra raghuraman,zeenat aman,7.2,Bhopal Express drama kay kay menon nethra raghuraman zeenat aman
Chehraa,0,1999,drama,ayub khan,madhoo,varsha usgaonkar,7.2,Chehraa drama ayub khan madhoo varsha usgaonkar
Daag The Fire,0,1999,action drama thriller,sanjay dutt,chandrachur singh,mahima chaudhry,4.8,Daag The Fire action drama thriller sanjay dutt chandrachur singh mahima chaudhry
Dahek A Burning Passion,0,1999,drama romance thriller,sonali bendre,danny denzongpa,anang desai,5.8,Dahek A Burning Passion drama romance thriller sonali bendre danny denzongpa anang desai
Dillagi,0,1999,drama family musical,sunny deol,bobby deol,urmila matondkar,5.4,Dillagi drama family musical sunny deol bobby deol urmila matondkar
Dulhan Banoo Main Teri,0,1999,action drama romance,arun bakshi,beena banerjee,sheeba bhakri,6.5,Dulhan Banoo Main Teri action drama romance arun bakshi beena banerjee sheeba bhakri
Gair,0,1999,action drama,ajay devgn,raveena tandon,reena roy,3.7,Gair action drama ajay devgn raveena tandon reena roy
Godmother,0,1999,crime drama thriller,shabana azmi,milind gunaji,nirmal pandey,6.8,Godmother crime drama thriller shabana azmi milind gunaji nirmal pandey
Dil Kya Kare,0,1999,drama musical romance,ajay devgn,mahima chaudhry,kajol,5.1,Dil Kya Kare drama musical romance ajay devgn mahima chaudhry kajol
Haseena Maan Jaayegi,0,1999,action comedy romance,sanjay dutt,govinda,karisma kapoor,6.2,Haseena Maan Jaayegi action comedy romance sanjay dutt govinda karisma kapoor
Hindustan Ki Kasam,0,1999,action drama,amitabh bachchan,ajay devgn,manisha koirala,3.4,Hindustan Ki Kasam action drama amitabh bachchan ajay devgn manisha koirala
Hogi Pyaar Ki Jeet,0,1999,action comedy drama,ajay devgn,neha,arshad warsi,4.3,Hogi Pyaar Ki Jeet action comedy drama ajay devgn neha arshad warsi
Hello Brother,0,1999,action comedy fantasy,salman khan,rani mukerji,arbaaz khan,4.8,Hello Brother action comedy fantasy salman khan rani mukerji arbaaz khan
Hu Tu Tu,0,1999,drama,nana patekar,sunil shetty,tabu,6.6,Hu Tu Tu drama nana patekar sunil shetty tabu
Hum Aapke Dil Mein Rehte Hain,0,1999,drama romance,anil kapoor,kajol,anupam kher,5.7,Hum Aapke Dil Mein Rehte Hain drama romance anil kapoor kajol anupam kher
Hum Dil De Chuke Sanam,0,1999,comedy drama musical,aishwarya rai bachchan,salman khan,ajay devgn,7.5,Hum Dil De Chuke Sanam comedy drama musical aishwarya rai bachchan salman khan ajay devgn
Hum Saath-Saath Hain We Stand United,0,1999,drama family musical,salman khan,karisma kapoor,saif ali khan,6.2,Hum Saath-Saath Hain We Stand United drama family musical salman khan karisma kapoor saif ali khan
Hote Hote Pyar Hogaya,0,1999,action crime romance,kajol,atul agnihotri,jackie shroff,5.1,Hote Hote Pyar Hogaya action crime romance kajol atul agnihotri jackie shroff
Heera Lal Panna Lal,0,1999,action comedy crime,mithun chakraborty,johnny lever,payal malhotra,4.0,Heera Lal Panna Lal action comedy crime mithun chakraborty johnny lever payal malhotra
International Khiladi,0,1999,action crime drama,akshay kumar,twinkle khanna,rajat bedi,4.8,International Khiladi action crime drama akshay kumar twinkle khanna rajat bedi
Jaanam Samjha Karo,0,1999,drama romance,salman khan,urmila matondkar,jaspal bhatti,4.8,Jaanam Samjha Karo drama romance salman khan urmila matondkar jaspal bhatti
Jaanwar,0,1999,action crime drama,akshay kumar,karisma kapoor,shilpa shetty kundra,5.9,Jaanwar action crime drama akshay kumar karisma kapoor shilpa shetty kundra
Kaala Samrajya,0,1999,action crime romance,sunil shetty,monica bedi,amrish puri,4.0,Kaala Samrajya action crime romance sunil shetty monica bedi amrish puri
Jahan Tum Le Chalo,0,1999,romance,rana jung bahadur,shail chaturvedi,sonali kulkarni,6.4,Jahan Tum Le Chalo romance rana jung bahadur shail chaturvedi sonali kulkarni
Kachche Dhaage,0,1999,action drama thriller,ajay devgn,saif ali khan,manisha koirala,6.0,Kachche Dhaage action drama thriller ajay devgn saif ali khan manisha koirala
Hum Tum Pe Marte Hain,0,1999,romance,govinda,urmila matondkar,dimple kapadia,5.4,Hum Tum Pe Marte Hain romance govinda urmila matondkar dimple kapadia
Kartoos,0,1999,action crime thriller,sanjay dutt,jackie shroff,manisha koirala,5.2,Kartoos action crime thriller sanjay dutt jackie shroff manisha koirala
Kohram,0,1999,action comedy drama,amitabh bachchan,nana patekar,tabu,5.4,Kohram action comedy drama amitabh bachchan nana patekar tabu
Kaun?,0,1999,mystery thriller,urmila matondkar,manoj bajpayee,,7.8,Kaun? mystery thriller urmila matondkar manoj bajpayee 
Khoobsurat,0,1999,action comedy romance,sanjay dutt,urmila matondkar,om puri,5.3,Khoobsurat action comedy romance sanjay dutt urmila matondkar om puri
Lal Baadshah,0,1999,action crime drama,amitabh bachchan,manisha koirala,shilpa shetty kundra,3.2,Lal Baadshah action crime drama amitabh bachchan manisha koirala shilpa shetty kundra
Kahani Kismat Ki,0,1999,action,laxmikant berde,mithun chakraborty,shama deshpande,5.2,Kahani Kismat Ki action laxmikant berde mithun chakraborty shama deshpande
Laawaris,0,1999,action,jackie shroff,dimple kapadia,akshaye khanna,4.4,Laawaris action jackie shroff dimple kapadia akshaye khanna
Mann,0,1999,drama romance,aamir khan,manisha koirala,sharmila tagore,6.2,Mann drama romance aamir khan manisha koirala sharmila tagore
Mast,0,1999,fantasy musical romance,urmila matondkar,aftab shivdasani,dalip tahil,5.4,Mast fantasy musical romance urmila matondkar aftab shivdasani dalip tahil
Pyaar Koi Khel Nahin,0,1999,drama romance thriller,sunny deol,mahima chaudhry,apoorva agnihotri,3.3,Pyaar Koi Khel Nahin drama romance thriller sunny deol mahima chaudhry apoorva agnihotri
Pyaar Mein Kabhi Kabhi...,0,1999,comedy drama musical,dino morea,rinke khanna,,4.4,Pyaar Mein Kabhi Kabhi... comedy drama musical dino morea rinke khanna 
Nyaydaata,0,1999,action,tinnu anand,aparajita,asrani,5.2,Nyaydaata action tinnu anand aparajita asrani
Rajaji,0,1999,comedy romance,govinda,raveena tandon,satish kaushik,4.6,Rajaji comedy romance govinda raveena tandon satish kaushik
Conflict,0,1998,drama,rajeshwari sachdev,rajit kapoor,ravi jhankal,7.7,Conflict drama rajeshwari sachdev rajit kapoor ravi jhankal
Sangharsh,0,1999,action drama thriller,preity zinta,akshay kumar,ashutosh rana,6.8,Sangharsh action drama thriller preity zinta akshay kumar ashutosh rana
Mother,0,1999,comedy drama family,jeetendra,rekha,randhir kapoor,4.5,Mother comedy drama family jeetendra rekha randhir kapoor
Phool Aur Aag,0,1999,action comedy crime,mithun chakraborty,jackie shroff,archana,4.7,Phool Aur Aag action comedy crime mithun chakraborty jackie shroff archana
Safari,0,1999,action adventure romance,sanjay dutt,juhi chawla,tanuja,4.5,Safari action adventure romance sanjay dutt juhi chawla tanuja
Naukar Ki Kameez,0,1999,\n,samir ahmed,vikrishnah batt,anu joseph,6.8,Naukar Ki Kameez \n samir ahmed vikrishnah batt anu joseph
Shool,0,1999,action crime drama,manoj bajpayee,raveena tandon,sayaji shinde,7.7,Shool action crime drama manoj bajpayee raveena tandon sayaji shinde
Split Wide Open,0,1999,crime drama,rahul bose,laila rouass,shivaji satam,6.6,Split Wide Open crime drama rahul bose laila rouass shivaji satam
Sanyasi Mera Naam,0,1999,action,rana jung bahadur,mithun chakraborty,siddharth dhawan,5.1,Sanyasi Mera Naam action rana jung bahadur mithun chakraborty siddharth dhawan
Silsila Hai Pyar Ka,0,1999,comedy drama romance,karisma kapoor,chandrachur singh,aruna irani,2.5,Silsila Hai Pyar Ka comedy drama romance karisma kapoor chandrachur singh aruna irani
Trishakti,0,1999,action crime drama,sadashiv amrapurkar,milind gunaji,jatin kanakia,4.4,Trishakti action crime drama sadashiv amrapurkar milind gunaji jatin kanakia
Vaastav The Reality,0,1999,action crime drama,sanjay dutt,namrata shirodkar,mohnish bahl,8.0,Vaastav The Reality action crime drama sanjay dutt namrata shirodkar mohnish bahl
Thakshak,0,1999,action crime drama,ajay devgn,tabu,amrish puri,5.9,Thakshak action crime drama ajay devgn tabu amrish puri
Sooryavansham,0,1999,action drama,amitabh bachchan,soundarya,rachana banerjee,6.2,Sooryavansham action drama amitabh bachchan soundarya rachana banerjee
Shera,0,1999,action,asrani,mithun chakraborty,pinky chinoy,5.4,Shera action asrani mithun chakraborty pinky chinoy
Sarfarosh,0,1999,action drama,aamir khan,naseeruddin shah,sonali bendre,8.1,Sarfarosh action drama aamir khan naseeruddin shah sonali bendre
Kuch Kuch Hota Hai,0,1998,comedy drama musical,shah rukh khan,kajol,rani mukerji,7.7,Kuch Kuch Hota Hai comedy drama musical shah rukh khan kajol rani mukerji
Zulmi,0,1999,action drama,akshay kumar,twinkle khanna,aruna irani,4.6,Zulmi action drama akshay kumar twinkle khanna aruna irani
Soldier,0,1998,action drama musical,bobby deol,preity zinta,rakhee gulzar,6.1,Soldier action drama musical bobby deol preity zinta rakhee gulzar
Pyaar To Hona Hi Tha,0,1998,comedy drama romance,ajay devgn,kajol,bijay anand,6.7,Pyaar To Hona Hi Tha comedy drama romance ajay devgn kajol bijay anand
Taal,0,1999,musical romance,akshaye khanna,anil kapoor,aishwarya rai bachchan,6.7,Taal musical romance akshaye khanna anil kapoor aishwarya rai bachchan
Only You,0,1999,drama romance,sanjay kapoor,priya gill,sushmita sen,6.1,Only You drama romance sanjay kapoor priya gill sushmita sen
Pyaar Kiya To Darna Kya,0,1998,action comedy drama,salman khan,kajol,arbaaz khan,6.7,Pyaar Kiya To Darna Kya action comedy drama salman khan kajol arbaaz khan
Dil Se..,0,1998,drama romance,shah rukh khan,manisha koirala,preity zinta,7.6,Dil Se.. drama romance shah rukh khan manisha koirala preity zinta
Dil Se..,0,1998,drama romance,shah rukh khan,manisha koirala,preity zinta,7.6,Dil Se.. drama romance shah rukh khan manisha koirala preity zinta
Dil Se..,0,1998,drama romance,shah rukh khan,manisha koirala,preity zinta,7.6,Dil Se.. drama romance shah rukh khan manisha koirala preity zinta
Dil Se..,0,1998,drama romance,shah rukh khan,manisha koirala,preity zinta,7.6,Dil Se.. drama romance shah rukh khan manisha koirala preity zinta
Dil Se..,0,1998,drama romance,shah rukh khan,manisha koirala,preity zinta,7.6,Dil Se.. drama romance shah rukh khan manisha koirala preity zinta
Dil Se..,0,1998,drama romance,shah rukh khan,manisha koirala,preity zinta,7.6,Dil Se.. drama romance shah rukh khan manisha koirala preity zinta
Dil Se..,0,1998,drama romance,shah rukh khan,manisha koirala,preity zinta,7.6,Dil Se.. drama romance shah rukh khan manisha koirala preity zinta
Dil Se..,0,1998,drama romance,shah rukh khan,manisha koirala,preity zinta,7.6,Dil Se.. drama romance shah rukh khan manisha koirala preity zinta
Ghulam,0,1998,action crime drama,aamir khan,rani mukerji,rajit kapoor,7.3,Ghulam action crime drama aamir khan rani mukerji rajit kapoor
Ghulam,0,1998,action crime drama,aamir khan,rani mukerji,rajit kapoor,7.3,Ghulam action crime drama aamir khan rani mukerji rajit kapoor
Ghulam,0,1998,action crime drama,aamir khan,rani mukerji,rajit kapoor,7.3,Ghulam action crime drama aamir khan rani mukerji rajit kapoor
Ghulam,0,1998,action crime drama,aamir khan,rani mukerji,rajit kapoor,7.3,Ghulam action crime drama aamir khan rani mukerji rajit kapoor
Ghulam,0,1998,action crime drama,aamir khan,rani mukerji,rajit kapoor,7.3,Ghulam action crime drama aamir khan rani mukerji rajit kapoor
Ghulam,0,1998,action crime drama,aamir khan,rani mukerji,rajit kapoor,7.3,Ghulam action crime drama aamir khan rani mukerji rajit kapoor
Ghulam,0,1998,action crime drama,aamir khan,rani mukerji,rajit kapoor,7.3,Ghulam action crime drama aamir khan rani mukerji rajit kapoor
Ghulam,0,1998,action crime drama,aamir khan,rani mukerji,rajit kapoor,7.3,Ghulam action crime drama aamir khan rani mukerji rajit kapoor
Major Saab,0,1998,action drama romance,amitabh bachchan,ajay devgn,sonali bendre,5.3,Major Saab action drama romance amitabh bachchan ajay devgn sonali bendre
Yeh Hai Mumbai Meri Jaan,0,1999,action comedy romance,saif ali khan,twinkle khanna,chunky pandey,4.6,Yeh Hai Mumbai Meri Jaan action comedy romance saif ali khan twinkle khanna chunky pandey
Dulhe Raja,0,1998,comedy,govinda,raveena tandon,kader khan,6.6,Dulhe Raja comedy govinda raveena tandon kader khan
Dulhe Raja,0,1998,comedy,govinda,raveena tandon,kader khan,6.6,Dulhe Raja comedy govinda raveena tandon kader khan
Dulhe Raja,0,1998,comedy,govinda,raveena tandon,kader khan,6.6,Dulhe Raja comedy govinda raveena tandon kader khan
Dulhe Raja,0,1998,comedy,govinda,raveena tandon,kader khan,6.6,Dulhe Raja comedy govinda raveena tandon kader khan
Dulhe Raja,0,1998,comedy,govinda,raveena tandon,kader khan,6.6,Dulhe Raja comedy govinda raveena tandon kader khan
Dulhe Raja,0,1998,comedy,govinda,raveena tandon,kader khan,6.6,Dulhe Raja comedy govinda raveena tandon kader khan
Dulhe Raja,0,1998,comedy,govinda,raveena tandon,kader khan,6.6,Dulhe Raja comedy govinda raveena tandon kader khan
Dulhe Raja,0,1998,comedy,govinda,raveena tandon,kader khan,6.6,Dulhe Raja comedy govinda raveena tandon kader khan
Bade Miyan Chote Miyan,0,1998,action comedy musical,amitabh bachchan,govinda,raveena tandon,5.8,Bade Miyan Chote Miyan action comedy musical amitabh bachchan govinda raveena tandon
China Gate,0,1998,action adventure drama,om puri,naseeruddin shah,danny denzongpa,6.6,China Gate action adventure drama om puri naseeruddin shah danny denzongpa
2001 Do Hazaar Ek,0,1998,crime mystery thriller,jackie shroff,dimple kapadia,tabu,3.6,2001 Do Hazaar Ek crime mystery thriller jackie shroff dimple kapadia tabu
Aakrosh Cyclone of Anger,0,1998,action crime drama,sunil shetty,shilpa shetty kundra,girish karnad,4.8,Aakrosh Cyclone of Anger action crime drama sunil shetty shilpa shetty kundra girish karnad
Achanak,0,1998,action mystery thriller,govinda,manisha koirala,farha naaz,4.2,Achanak action mystery thriller govinda manisha koirala farha naaz
Badmaash,0,1998,action,jackie shroff,shilpa shirodkar,paresh rawal,2.5,Badmaash action jackie shroff shilpa shirodkar paresh rawal
Bandhan,0,1998,action drama romance,jackie shroff,salman khan,rambha,4.8,Bandhan action drama romance jackie shroff salman khan rambha
Dand Nayak,0,1998,action,arjun,arun bakshi,arun bali,3.5,Dand Nayak action arjun arun bakshi arun bali
Aunty No. 1,0,1998,comedy drama romance,govinda,raveena tandon,harish,4.3,Aunty No. 1 comedy drama romance govinda raveena tandon harish
Doli Saja Ke Rakhna,0,1998,drama romance,akshaye khanna,jyotika,anupam kher,6.3,Doli Saja Ke Rakhna drama romance akshaye khanna jyotika anupam kher
Duplicate,0,1998,action comedy crime,shah rukh khan,juhi chawla,sonali bendre,5.5,Duplicate action comedy crime shah rukh khan juhi chawla sonali bendre
Dushman,0,1998,crime drama thriller,kajol,sanjay dutt,ashutosh rana,6.9,Dushman crime drama thriller kajol sanjay dutt ashutosh rana
Gharwali Baharwali,0,1998,comedy,anil kapoor,raveena tandon,rambha,4.6,Gharwali Baharwali comedy anil kapoor raveena tandon rambha
Dhoondte Reh Jaaoge!,0,1998,comedy drama family,amar upadhyaya,antara mali,,5.0,Dhoondte Reh Jaaoge! comedy drama family amar upadhyaya antara mali 
Do Numbri,0,1998,action,mithun chakraborty,sneha,sadashiv amrapurkar,4.5,Do Numbri action mithun chakraborty sneha sadashiv amrapurkar
My Dear Kuttichaathan,0,1984,action adventure comedy,arvind,sonia,suresh,7.4,My Dear Kuttichaathan action adventure comedy arvind sonia suresh
Ghar Bazar,0,1998,action crime drama,shekhar suman,natasha shailendra,sharmila tagore,5.0,Ghar Bazar action crime drama shekhar suman natasha shailendra sharmila tagore
Gunda,0,1998,action comedy crime,mithun chakraborty,mukesh rishi,mohan joshi,7.3,Gunda action comedy crime mithun chakraborty mukesh rishi mohan joshi
Ganga Ki Kasam,0,1998,drama,mithun chakraborty,jackie shroff,deepti bhatnagar,3.7,Ganga Ki Kasam drama mithun chakraborty jackie shroff deepti bhatnagar
Himmatwala,0,1998,action,tinnu anand,beena banerjee,mithun chakraborty,4.6,Himmatwala action tinnu anand beena banerjee mithun chakraborty
Humse Badhkar Kaun The Entertainer,0,1998,action comedy,sunil shetty,saif ali khan,sonali bendre,3.9,Humse Badhkar Kaun The Entertainer action comedy sunil shetty saif ali khan sonali bendre
Hitler,0,1998,crime,mithun chakraborty,shilpa shirodkar,manek bedi,5.6,Hitler crime mithun chakraborty shilpa shirodkar manek bedi
Hero Hindustani,0,1998,action comedy drama,arshad warsi,namrata shirodkar,kader khan,4.8,Hero Hindustani action comedy drama arshad warsi namrata shirodkar kader khan
Hazaar Chaurasi Ki Maa,0,1998,drama,jaya bachchan,anupam kher,seema biswas,7.2,Hazaar Chaurasi Ki Maa drama jaya bachchan anupam kher seema biswas
Hafta Vasuli,0,1998,action,jackie shroff,aditya pancholi,ayub khan,5.6,Hafta Vasuli action jackie shroff aditya pancholi ayub khan
Kabhi Na Kabhi,0,1998,action crime romance,jackie shroff,anil kapoor,pooja bhatt,4.4,Kabhi Na Kabhi action crime romance jackie shroff anil kapoor pooja bhatt
Iski Topi Uske Sarr,0,1998,action crime drama,arun bakshi,prem chopra,sunny deol,4.6,Iski Topi Uske Sarr action crime drama arun bakshi prem chopra sunny deol
When One Falls in Love,0,1998,comedy drama romance,salman khan,twinkle khanna,johnny lever,5.8,When One Falls in Love comedy drama romance salman khan twinkle khanna johnny lever
Jhooth Bole Kauwa Kaate,0,1998,comedy romance,anil kapoor,juhi chawla,amrish puri,5.7,Jhooth Bole Kauwa Kaate comedy romance anil kapoor juhi chawla amrish puri
Kudrat,0,1998,action drama romance,akshaye khanna,urmila matondkar,maya alagh,4.5,Kudrat action drama romance akshaye khanna urmila matondkar maya alagh
Maharaja,0,1998,adventure family fantasy,govinda,manisha koirala,raj babbar,4.0,Maharaja adventure family fantasy govinda manisha koirala raj babbar
